{
  "date": "2026-10-30",
  "milestone": "J1",
  "commit": "cb765d761beb5f8dcc3185ea06061bfe953d142c",
  "total": 85,
  "categories": [
    {
      "id": 1,
      "name": "Secret handling",
      "max": 15,
      "score": 13
    },
    {
      "id": 2,
      "name": "Session storage",
      "max": 10,
      "score": 10
    },
    {
      "id": 3,
      "name": "Browser isolation",
      "max": 15,
      "score": 12
    },
    {
      "id": 4,
      "name": "Logging and redaction",
      "max": 10,
      "score": 9
    },
    {
      "id": 5,
      "name": "Network boundary",
      "max": 10,
      "score": 8
    },
    {
      "id": 6,
      "name": "File system",
      "max": 10,
      "score": 8
    },
    {
      "id": 7,
      "name": "Input handling",
      "max": 10,
      "score": 9
    },
    {
      "id": 8,
      "name": "Dependencies and build",
      "max": 10,
      "score": 6
    },
    {
      "id": 9,
      "name": "PWA and local UI",
      "max": 5,
      "score": 5
    },
    {
      "id": 10,
      "name": "Documentation",
      "max": 5,
      "score": 5
    }
  ],
  "findings": [
    {
      "id": "SEC-J0-1",
      "category": 5,
      "severity": "medium",
      "location": "internal/httpx/httpx.go",
      "status": "fixed",
      "regression_test": "TestClient_RefusesOpaqueURL, TestClient_RefusesOpaqueRedirectHop, TestAttack_HttpxOpaqueAbsoluteFormTargetsOtherHost"
    },
    {
      "id": "SEC-J0-2",
      "category": 4,
      "severity": "low",
      "location": "internal/orchestrator/run.go",
      "status": "fixed",
      "regression_test": "TestAttack_OrchInvalidConnectorIDNeverReachesReport"
    },
    {
      "id": "SEC-J0-3",
      "category": 4,
      "severity": "medium",
      "location": "internal/orchestrator/run.go, internal/orchestrator/report.go",
      "status": "fixed",
      "regression_test": "TestRun_RefusesUnsafeProviderID, TestReport_CleansSupplierStrings, TestAttack_OrchProviderIDSecretNeverReachesReport"
    },
    {
      "id": "SEC-J0-4",
      "category": 4,
      "severity": "medium",
      "location": "internal/logx/logx.go",
      "status": "fixed",
      "regression_test": "TestHandler_CleansKeysAndGroupNames, TestAttack_LogxCanaryInAttrKeysNeverWritten"
    },
    {
      "id": "SEC-J0-5",
      "category": 4,
      "severity": "medium",
      "location": "internal/logx/kv.go",
      "status": "fixed",
      "regression_test": "TestClean_MasksValueAfterSensitiveKeyInFreeText, TestAttack_LogxFreeTextKeyValueSecrets"
    },
    {
      "id": "SEC-J0-6",
      "category": 7,
      "severity": "low",
      "location": "internal/normalize/facturx/parse.go",
      "status": "fixed",
      "regression_test": "TestParseCII_FieldCharacters, TestAttack_ParseCIIRejectsSurrogateCharRef"
    },
    {
      "id": "SEC-J0-7",
      "category": 1,
      "severity": "medium",
      "location": "internal/secret/bitwarden/bitwarden.go:243",
      "status": "fixed",
      "regression_test": "TestBitwarden_LocksOnCloseAndError"
    },
    {
      "id": "SEC-J0-8",
      "category": 6,
      "severity": "medium",
      "location": "cmd/facto/statedir.go:29",
      "status": "fixed",
      "regression_test": "TestCheckStateDirOutside, TestAttack_CLIStateDirInsideOutputThroughSymlinkRefused"
    },
    {
      "id": "SEC-J0-9",
      "category": 1,
      "severity": "low",
      "location": "internal/config/validate.go:70",
      "status": "fixed",
      "regression_test": "TestAttack_ConfigNamingTemplateErrorsNeverEchoValue"
    },
    {
      "id": "SEC-J0-10",
      "category": 7,
      "severity": "low",
      "location": "internal/config/load.go:158",
      "status": "fixed",
      "regression_test": "TestLoad_TypeErrorsCapped"
    },
    {
      "id": "SEC-J0-11",
      "category": 8,
      "severity": "high",
      "location": "go.mod:3",
      "status": "fixed",
      "regression_test": "make audit govulncheck gate (security/scanners.json govulncheck), weekly .github/workflows/security.yml"
    },
    {
      "id": "SEC-J0-12",
      "category": 8,
      "severity": "medium",
      "location": "tools/go.mod (mholt/archives v0.1.5, nwaples/rardecode/v2 v2.2.0), osv-scanner.toml (GO-2026-5932 ignored until 2027-01-31)",
      "status": "fixed",
      "regression_test": "make audit osv-scanner gate (security/scanners.json osv-scanner), .github/workflows/security.yml osv-scanner step"
    },
    {
      "id": "SEC-J0-13",
      "category": 8,
      "severity": "medium",
      "location": ".goreleaser.yaml, .github/workflows/release.yml:20",
      "status": "fixed",
      "regression_test": "make release-check (goreleaser check + snapshot build)"
    },
    {
      "id": "SEC-J0-14",
      "category": 8,
      "severity": "low",
      "location": "internal/secret/bitwarden/exec.go:40, scripts/release-e2e-check/main.go:518, internal/browser/client.go:157, internal/browser/page.go:291, internal/browser/pool_windows.go:26, 49 test-file suppressions, osv-scanner.toml:1-4, .gitleaksignore, osv-scanner.toml, tools/osv-scanner.toml (cite SEC-J0-14 instead of an issue number)",
      "status": "open"
    },
    {
      "id": "SEC-J0-15",
      "category": 5,
      "severity": "medium",
      "location": ".golangci.yml:55-79, internal/httpx/boundary_test.go",
      "status": "fixed",
      "regression_test": "TestModule_NetworkOnlyThroughHTTPX, TestNetworkViolations_Detector, depguard network rule (make lint)"
    },
    {
      "id": "SEC-J0-16",
      "category": 6,
      "severity": "low",
      "location": ".golangci.yml:34",
      "status": "fixed",
      "regression_test": "forbidigo fs-mutation rule (make lint)"
    },
    {
      "id": "SEC-J0-17",
      "category": 6,
      "severity": "low",
      "location": "internal/config/paths.go:67",
      "status": "fixed",
      "regression_test": "TestCheckStateDirOutside_SymlinkIntoDropboxRefused, TestPrepareStateDir_SyncedTargetRefusedWithoutOutputFolder"
    },
    {
      "id": "SEC-J0-18",
      "category": 6,
      "severity": "low",
      "location": "internal/fsx/perm_windows.go, internal/config/perm_windows.go",
      "status": "open"
    },
    {
      "id": "SEC-J0-19",
      "category": 4,
      "severity": "low",
      "location": "cmd/facto/main.go:118, internal/logx/escape.go",
      "status": "fixed",
      "regression_test": "TestAttack_WriteErrCannotDriveTerminal, TestAttack_WriteErrMasksSecrets, TestAttack_CLIUsageErrorCannotDriveTerminal, TestEscape"
    },
    {
      "id": "SEC-J0-20",
      "category": 4,
      "severity": "low",
      "location": "internal/logx/kv.go",
      "status": "open"
    },
    {
      "id": "SEC-J0-21",
      "category": 1,
      "severity": "low",
      "location": "internal/secret/bitwarden/exec.go:41",
      "status": "open"
    },
    {
      "id": "SEC-J0-22",
      "category": 1,
      "severity": "low",
      "location": "cmd/facto/collect.go:145-157, cmd/facto/login.go:104-112, test/e2e (no Vaultwarden scenario)",
      "status": "open"
    },
    {
      "id": "SEC-J0-23",
      "category": 7,
      "severity": "low",
      "location": "internal/secret/keyring/keyring.go:54",
      "status": "fixed",
      "regression_test": "TestKeyring_GetHonoursContext, TestKeyring_SetHonoursContext, TestKeyring_DeleteHonoursContext, TestKeyring_BackendCallsAreBounded, TestResolver_CloseAllNotBlockedByHungProvider"
    },
    {
      "id": "SEC-J0-24",
      "category": 7,
      "severity": "low",
      "location": "internal/secret/ref.go:51, internal/config/load.go:80, internal/logx/kv.go",
      "status": "fixed",
      "regression_test": "FuzzParseRef, FuzzParse, FuzzClean, FuzzClean_KeyShapedValue, TestClean_MasksValueAfterSwallowedKey"
    },
    {
      "id": "SEC-J0-25",
      "category": 5,
      "severity": "low",
      "location": ".golangci.yml:55-79, internal/httpx/boundary_test.go:25-38",
      "status": "open"
    },
    {
      "id": "SEC-J0-26",
      "category": 6,
      "severity": "low",
      "location": ".golangci.yml:30, .golangci.yml:34",
      "status": "open"
    },
    {
      "id": "SEC-J0-27",
      "category": 8,
      "severity": "medium",
      "location": ".github/workflows/release.yml:20, .github/workflows/security.yml:18-19, .github/workflows/ci.yml:17",
      "status": "open"
    },
    {
      "id": "SEC-J1-1",
      "category": 5,
      "severity": "high",
      "location": "internal/browser/flags.go:64-80, internal/browser/webrtc.go",
      "status": "fixed",
      "regression_test": "TestAttack_ChromeWebRTCToIPLiteral, TestChrome_WebRTCBlockedInCrossSiteFrame, TestChrome_NoWebRTCConstructorsInAnyDocument, TestFlags_WebRTCPolicyReachesChrome, TestCheckFlags_WebRTCPolicyMandatoryAndNotWeakened"
    },
    {
      "id": "SEC-J1-2",
      "category": 3,
      "severity": "low",
      "location": "internal/browser/freeze.go, internal/browser/page.go (TypeSecret)",
      "status": "fixed",
      "regression_test": "TestPage_TypeSecretFreezesPageScripts, TestPage_TypeSecretRefusedWhenScriptsCannotBeFrozen, TestPage_FrameAttachedDuringFreezeStartsFrozen, TestAttack_ChromeFocusSwapNeverDeliversToCrossOriginFrame"
    },
    {
      "id": "SEC-J1-3",
      "category": 5,
      "severity": "low",
      "location": "internal/browser/fetch.go:288-416",
      "status": "fixed",
      "regression_test": "TestFetch_SharedWorkerNestedFailClosed, TestAttack_SharedWorkerGetsAutoAttachBeforeResume, TestAttack_ChromeSharedWorkerNestedWorkerFetchBlocked"
    },
    {
      "id": "SEC-J1-4",
      "category": 5,
      "severity": "low",
      "location": "internal/browser/flags_e2e.go",
      "status": "fixed",
      "regression_test": "TestFlagsE2E_NoNameReachesRealDNS, TestAttack_E2EWildcardAllowlistNeverReachesRealDNS"
    },
    {
      "id": "SEC-J1-5",
      "category": 5,
      "severity": "low",
      "location": "internal/browser/page.go (Navigate)",
      "status": "fixed",
      "regression_test": "TestPage_NavigatePortRules"
    },
    {